[
  {
    "visit_id": "15a7b744-e99e-5fd6-bc96-9c1e6d01c1e5",
    "visit_number": "VIS-SYN-0002",
    "inquiry_id": "bcb70ef6-01ac-5e0e-8a8d-fe5af43e8bde",
    "technician_id": "c2bafcaf-b050-5388-8c90-03367c0e34e8",
    "status": "COMPLETED",
    "requested_at": "2026-07-02T00:00:00+09:00",
    "scheduled_at": "2026-07-04T00:00:00+09:00",
    "started_at": "2026-07-04T00:00:00+09:00",
    "completed_at": "2026-07-04T01:00:00+09:00",
    "confirmed_cause": "필터 체결 상태와 출수 유로 점검 필요",
    "action_taken": "필터 체결 상태를 재점검하고 출수 유로를 정비한 뒤 출수량 정상화를 확인함",
    "state_version": 3,
    "idempotency_key": "idem-visit-002-completed",
    "correlation_id": "e5a21d79-f423-5795-aae1-10a5ba772937",
    "data_classification": "synthetic"
  },
  {
    "visit_id": "d7d909d5-b387-5bea-bf97-c890ff033913",
    "visit_number": "VIS-SYN-0008",
    "inquiry_id": "a6bdf6b7-b9ba-553a-8447-f928384c1ad1",
    "technician_id": null,
    "status": "ASSIGNING",
    "requested_at": "2026-07-03T11:30:00+09:00",
    "scheduled_at": null,
    "started_at": null,
    "completed_at": null,
    "confirmed_cause": null,
    "action_taken": null,
    "state_version": 1,
    "idempotency_key": "idem-visit-008",
    "correlation_id": "d9c5de5d-7b45-5893-a1f3-eff31a160642",
    "data_classification": "synthetic"
  },
  {
    "visit_id": "db1143fa-1f1a-5e1e-b469-9f841846a778",
    "visit_number": "VIS-SYN-0014",
    "inquiry_id": "60d83c53-efc8-5467-a13b-0f45f9ea9177",
    "technician_id": "c2bafcaf-b050-5388-8c90-03367c0e34e8",
    "status": "IN_PROGRESS",
    "requested_at": "2026-07-04T23:00:00+09:00",
    "scheduled_at": "2026-07-06T23:30:00+09:00",
    "started_at": "2026-07-05T00:00:00+09:00",
    "completed_at": null,
    "confirmed_cause": null,
    "action_taken": null,
    "state_version": 1,
    "idempotency_key": "idem-visit-014",
    "correlation_id": "6485e221-0f76-54ca-84ce-1da93c81a4bb",
    "data_classification": "synthetic"
  },
  {
    "visit_id": "541316f8-42a4-53e8-baac-56878489b654",
    "visit_number": "VIS-SYN-0018",
    "inquiry_id": "cd9adf11-fd61-57fd-956a-6dfac43fcb3d",
    "technician_id": "c2bafcaf-b050-5388-8c90-03367c0e34e8",
    "status": "COMPLETED",
    "requested_at": "2026-07-05T23:00:00+09:00",
    "scheduled_at": "2026-07-07T23:30:00+09:00",
    "started_at": "2026-07-06T00:00:00+09:00",
    "completed_at": "2026-07-06T00:30:00+09:00",
    "confirmed_cause": "INSTANT_HOT_WATER_SAFETY 합성 확인 원인",
    "action_taken": "합성 점검 및 안전 확인 완료",
    "state_version": 1,
    "idempotency_key": "idem-visit-018",
    "correlation_id": "7d61749d-e291-543f-af63-837f088fd3d7",
    "data_classification": "synthetic"
  },
  {
    "visit_id": "8bb05560-d890-54f0-802d-c38bb64bca23",
    "visit_number": "VIS-SYN-0021",
    "inquiry_id": "d8155085-e77d-5a61-a6e3-57a7d584487a",
    "technician_id": "2ebf6029-15f2-5a1a-89db-ed7aa0fb1fca",
    "status": "COMPLETED",
    "requested_at": "2026-07-06T17:30:00+09:00",
    "scheduled_at": "2026-07-08T18:00:00+09:00",
    "started_at": "2026-07-06T18:30:00+09:00",
    "completed_at": "2026-07-06T19:00:00+09:00",
    "confirmed_cause": "NOISE 합성 확인 원인",
    "action_taken": "합성 점검 및 안전 확인 완료",
    "state_version": 1,
    "idempotency_key": "idem-visit-021",
    "correlation_id": "33cbb0d7-41ec-538d-8698-c6ab0bd6ee3e",
    "data_classification": "synthetic"
  }
]
